<!ELEMENT layout (field*)>
<!ATTLIST layout 
vendor (intel|amd|arm|undefined) #IMPLIED
family CDATA #IMPLIED
version CDATA #IMPLIED>

<!ELEMENT field (name,nbits,default)>
<!ELEMENT name (#PCDATA)>
<!ELEMENT nbits (#PCDATA)>
<!ELEMENT default (#PCDATA)>
