<?xml version="1.0" encoding="UTF-8"?>
<!DOCTYPE layout SYSTEM "layout.dtd">
<layout vendor="intel" family="6">
	<!-- number of bits for each configurable field -->
		
  <field>
    <name>cmask</name>
    <nbits>8</nbits>
    <default>0</default>
  </field>
  <field>
    <name>inv</name>
    <nbits>1</nbits>
    <default>0</default>
  </field>
  <field>
    <name>os</name>
    <nbits>1</nbits>
    <default>0</default>
  </field>			
  <field>
    <name>usr</name>
    <nbits>1</nbits>
    <default>1</default>
  </field>	
  <field>
    <name>edge</name>
    <nbits>1</nbits>
    <default>1</default>
  </field>	
  <field>
    <name>umask</name>
    <nbits>8</nbits>
    <default>0</default>
  </field>	
		
</layout>
